{
  "record_schema_version": "1.0.0",
  "opportunity_id": "OPP-TC-10-001",
  "case_id": "CASE-TC-10",
  "source": {
    "source_id": "SRC-TC-10-OPP",
    "source_type": "synthetic",
    "source_location": "data/scenarios/frozen/v1.0.1/TC-10/inputs/opportunity_source.txt",
    "retrieved_at": "2026-08-05T16:10:00Z",
    "snapshot_date": "2026-08-05",
    "sha256": "e0b9b1348543d9b2c250dd63657f54bd4133410923aec4a108efaf16d54779e0",
    "approved_for_use": true,
    "approval_basis": "Synthetic frozen evaluation fixture approved for controlled capstone testing.",
    "notes": "Synthetic source snapshot created for frozen scenario evaluation; no real procurement record is represented."
  },
  "source_portal": "Project 7 Synthetic Evaluation Fixtures",
  "jurisdiction": "California",
  "agency": "Synthetic California Public Agency",
  "solicitation_id": "SYN-TC-10",
  "title": "Enterprise IT Strategy, Program Management, and Systems Integration Support",
  "normalized_title": "enterprise it strategy, program management, and systems integration support",
  "description": "Provide IT strategy, program and project management, systems integration, agile delivery support, organizational change management, and technical training.",
  "status": "open",
  "posted_at": "2026-08-01T00:00:00Z",
  "due_at": "2026-09-15T23:59:59Z",
  "fiscal_year": "2026",
  "fiscal_quarter": "Q3",
  "place_of_performance": "California",
  "procurement_method": "Synthetic evaluation fixture",
  "contract_vehicle": null,
  "estimated_value": null,
  "ingested_at": "2026-08-05T16:10:00Z",
  "normalization_version": "1.0.1",
  "record_key": "859c5eae497140e2d103",
  "original_values": {
    "title": "Enterprise IT Strategy, Program Management, and Systems Integration Support",
    "agency": "Synthetic California Public Agency",
    "due_at": "09/15/2026"
  },
  "missing_fields": [],
  "data_freshness_days": 4,
  "limitations": []
}
