{
  "record_schema_version": "1.0.0",
  "opportunity_id": "OPP-TC-03-001",
  "case_id": "CASE-TC-03",
  "source": {
    "source_id": "SRC-TC-03-OPP",
    "source_type": "synthetic",
    "source_location": "data/scenarios/frozen/v1.0.1/TC-03/inputs/opportunity_source.txt",
    "retrieved_at": "2026-08-05T16:10:00Z",
    "snapshot_date": "2026-08-05",
    "sha256": "6efc609cf221e65bdbcecea6d2a43f4b03b17b2e37b57f4151c7415573351b0b",
    "approved_for_use": true,
    "approval_basis": "Synthetic frozen evaluation fixture approved for controlled capstone testing.",
    "notes": "Synthetic source snapshot created for frozen scenario evaluation; no real procurement record is represented."
  },
  "source_portal": "Project 7 Synthetic Evaluation Fixtures",
  "jurisdiction": "California",
  "agency": "Synthetic California Public Agency",
  "solicitation_id": "SYN-TC-03",
  "title": "Consulting Support Services",
  "normalized_title": "consulting support services",
  "description": "Provide consulting support as requested. Detailed scope, deliverables, qualifications, and service categories are pending.",
  "status": "open",
  "posted_at": "2026-08-01T00:00:00Z",
  "due_at": "2026-09-15T23:59:59Z",
  "fiscal_year": "2026",
  "fiscal_quarter": "Q3",
  "place_of_performance": "California",
  "procurement_method": "Synthetic evaluation fixture",
  "contract_vehicle": null,
  "estimated_value": null,
  "ingested_at": "2026-08-05T16:10:00Z",
  "normalization_version": "1.0.1",
  "record_key": "0b2b687e039bdbca3644",
  "original_values": {
    "title": "Consulting Support Services",
    "agency": "Synthetic California Public Agency",
    "due_at": "09/15/2026"
  },
  "missing_fields": [
    "detailed_scope",
    "deliverables",
    "required_qualifications",
    "estimated_duration"
  ],
  "data_freshness_days": 4,
  "limitations": [
    {
      "code": "STRUCTURED_ANALYSIS_INSUFFICIENT",
      "description": "The synthetic opportunity record intentionally omits the following fields: detailed_scope, deliverables, required_qualifications, estimated_duration.",
      "material": true,
      "mitigation": "Route the case to the named human reviewer and preserve the limitation in the decision-support packet."
    }
  ]
}
