{
  "record_schema_version": "1.0.0",
  "opportunity_id": "OPP-TC-04-001",
  "case_id": "CASE-TC-04",
  "source": {
    "source_id": "SRC-TC-04-OPP",
    "source_type": "synthetic",
    "source_location": "data/scenarios/frozen/v1.0.1/TC-04/inputs/opportunity_source.txt",
    "retrieved_at": "2026-08-05T16:10:00Z",
    "snapshot_date": "2026-08-05",
    "sha256": "ba1812071db6d82ce65ca3bc73700fcbe06e5fec1387fef555af5021a1613a56",
    "approved_for_use": true,
    "approval_basis": "Synthetic frozen evaluation fixture approved for controlled capstone testing.",
    "notes": "Synthetic source snapshot created for frozen scenario evaluation; no real procurement record is represented."
  },
  "source_portal": "Project 7 Synthetic Evaluation Fixtures",
  "jurisdiction": "California",
  "agency": "Synthetic California Public Agency",
  "solicitation_id": "SYN-TC-04",
  "title": "Enterprise IT Strategy, Program Management, and Systems Integration Support",
  "normalized_title": "enterprise it strategy, program management, and systems integration support",
  "description": null,
  "status": "open",
  "posted_at": null,
  "due_at": null,
  "fiscal_year": "2026",
  "fiscal_quarter": "Q3",
  "place_of_performance": "California",
  "procurement_method": "Synthetic evaluation fixture",
  "contract_vehicle": null,
  "estimated_value": null,
  "ingested_at": "2026-08-05T16:10:00Z",
  "normalization_version": "1.0.1",
  "record_key": "c768e0e0c9b5b533284b",
  "original_values": {
    "title": "Enterprise IT Strategy, Program Management, and Systems Integration Support",
    "agency": "Synthetic California Public Agency",
    "due_at": null
  },
  "missing_fields": [
    "description",
    "due_date",
    "published_date",
    "deliverables",
    "qualifications"
  ],
  "data_freshness_days": 4,
  "limitations": [
    {
      "code": "STRUCTURED_ANALYSIS_INSUFFICIENT",
      "description": "The synthetic opportunity record intentionally omits the following fields: description, due_date, published_date, deliverables, qualifications.",
      "material": true,
      "mitigation": "Route the case to the named human reviewer and preserve the limitation in the decision-support packet."
    }
  ]
}
